Category,Title,Description,Startdate,Times,EventUrl,Neighborhood,Location,imageURl
Street Festival,Glenwood Avenue Arts Fest,"The 14th annual Glenwood Avenue Arts Fest (GAAF) is a free, weekend-long arts festival that features 100+ artists, open studios, and live entertainment on three outdoor stages. Experience art of all disciplines, music, theater, food and drink on the cobblestone streets of the Glenwood Avenue Arts District in Chicago’s historic Rogers Park neighborhood.

There is also a free Fest launch party, the Friday Night Cobblestone Jam, on Friday August 14, from 6pm to 10pm, at the North Stage, 7000 N. Glenwood.","August 15 & 16, 2015",11 am-9 pm,http://www.glenwoodave.org/,Rogers Park,"6920 N Glenwood Ave
Chicago, IL 60626",http://www.cityofchicago.org/content/dam/city/depts/dca/Neighborhood%20Festivals/glenwood800.jpg
Street Festival,Clark After Dark,"Support Illinois troops and their families with live music, drinks, live auction and a raffle. Over 2.4 million Americans serve our nation in Uniform. Over 80,000 troops from Illinois have deployed since 9/11. Over 300,000 receive support every year from the USO of Illinois.","August 20, 2015",4-10 pm,http://starevents.com/, ,"420 N Clark St. Chicago, IL 60654",http://www.cityofchicago.org/content/dam/city/depts/dca/Neighborhood%20Festivals/clarkdark600.jpg
Street Festival,Albany Park World Fest,"The eclectic northwest side neighborhood will celebrate its melting pot diversity at this 2nd annual festival. Features global music, food, arts & crafts and carnival rides.","August 22 & 23, 2015","Saturday, 12 Noon-10 pm; Sunday, 12 Noon-9 pm",http://www.chicagoevents.com/,Albany Park,"4798 N Kimball Ave. Chicago, IL 60625",http://www.cityofchicago.org/content/dam/city/depts/dca/Neighborhood%20Festivals/albany6002.jpg
Street Festival,Taste of Greektown,"Hellenic pride will take center stage when this annual culinary fest in Chicago's West Loop returns for its 26th year. Food and spirits from neighborhood eateries will again be the main attraction. There will also be entertainment including Greek bands and games for both kids and families.","August 22 & 23, 2015","12 Noon-11 pm",http://chicagoevents.com/event.cfm?eid=287,West Loop,"400 S. Halsted St.
Chicago, IL 60607",http://www.unieros.com/sites/default/files/images/tasteGreecePhotos.jpg
Street Festival,Chicago Fashion Fest,"Two days of non-stop fashionista action celebrating the latest looks from Chicago’s top designers and boutiques on a bleachered-in runway stage. Bands and DJs will set the tone as models tout “What’s in” in over 20 fashion runway show segments such as vintage, avante garde, bridal, teens & kids, doggie couture, ‘Do-Fashion’ (with only Division Street boutiques). "Shopper’s Row" is home to 50 exclusive booths of local fashion designers, boutiques, and salons, as well as food and drink tents and a dedicated “Back to School” kids area. Each night there's a Wicker Park after Dark charity-hosted red carpet extravaganza.","August 29 & 30, 2015","12 Noon-10 pm, Wicker Park After Dark runway shows 8 pm",http://www.chicagofashionfest.com/,Wicker Park/West Town,"1700 W. Division St. Chicago, IL 60622",http://svcdn.simpleviewinc.com/v3/cache/chicago/35AD3B6B9C586E559327521321B1B0AA.jpg
